<?xml version="1.0" encoding="UTF-8"?>
<Entities 
xmlns:xsi="http://www.w3.org/2001/XMLSchema-instance"
xsi:noNamespaceSchemaLocation="data.xsd">
    <Entity name="Flaming Sword">
		<Equipable />
		<Durability value="10"/>
		<Repairable />
        <Breakable />
        <Burnable />
        <OnSetEffect trigger="OnSet" 
            triggerValue="true" targetValue="true"
            source="Equipable" target="Burnable"
        />
	</Entity>
	<Entity name="Snake">
        <StatBlock 
            CON="5"
            STR="5"
            DEX="5"
            WIS="5"
            INT="5"
            CHA="5"
        />
    </Entity>
</Entities>